[
  {
    "schema": "task-dispatch/1",
    "ssot_id": "swarmbench-02-f95e17d3a2bf",
    "task_id": "swarmbench-02-backtest",
    "slice_id": "sb02--builder-long",
    "agent_type": "builder",
    "slice_kind": "work",
    "work_package_id": "pkg-alpha",
    "expected_work_s": 1500,
    "timebox_minutes": 12,
    "allowed_paths": [
      "/tmp/swarmbench-02/alpha"
    ],
    "ownership_paths": [
      "/tmp/swarmbench-02/alpha"
    ],
    "task_contract": {
      "goal": "Run long branch in parallel.",
      "acceptance": [
        "Long branch completes."
      ],
      "constraints": [
        "Only edit owned paths"
      ]
    }
  },
  {
    "schema": "task-dispatch/1",
    "ssot_id": "swarmbench-02-f95e17d3a2bf",
    "task_id": "swarmbench-02-backtest",
    "slice_id": "sb02--builder-short",
    "agent_type": "builder",
    "slice_kind": "work",
    "work_package_id": "pkg-beta",
    "expected_work_s": 300,
    "timebox_minutes": 12,
    "allowed_paths": [
      "/tmp/swarmbench-02/beta"
    ],
    "ownership_paths": [
      "/tmp/swarmbench-02/beta"
    ],
    "task_contract": {
      "goal": "Run short branch to unlock dependent micro follow-up.",
      "acceptance": [
        "Short branch completes."
      ],
      "constraints": [
        "Only edit owned paths"
      ]
    }
  },
  {
    "schema": "task-dispatch/1",
    "ssot_id": "swarmbench-02-f95e17d3a2bf",
    "task_id": "swarmbench-02-backtest",
    "slice_id": "sb02--builder-after-short",
    "agent_type": "builder",
    "slice_kind": "work",
    "work_package_id": "pkg-gamma",
    "expected_work_s": 1200,
    "timebox_minutes": 12,
    "allowed_paths": [
      "/tmp/swarmbench-02/gamma"
    ],
    "ownership_paths": [
      "/tmp/swarmbench-02/gamma"
    ],
    "dependencies": [
      "sb02--builder-short"
    ],
    "task_contract": {
      "goal": "Micro follow-up split into a separate ticket.",
      "acceptance": [
        "Dependent branch completes after short branch."
      ],
      "constraints": [
        "Only edit owned paths"
      ]
    }
  }
]
