[
  {
    "schema": "task-dispatch/1",
    "ssot_id": "ws2-dev-swarm-0d26dfd05c80",
    "task_id": "swarm-ticket-flow",
    "slice_id": "swarm--runner-inventory",
    "agent_type": "runner",
    "slice_kind": "probe",
    "timebox_minutes": 5,
    "allowed_paths": [],
    "ownership_paths": [],
    "dependencies": [],
    "task_contract": {
      "goal": "Inventory current protocol files and identify split boundaries.",
      "acceptance": [
        "List candidate write lanes with ownership boundaries.",
        "List initial dependency edges for safe scheduling."
      ],
      "constraints": [
        "Read-only.",
        "No repository edits."
      ],
      "no_touch": []
    },
    "evidence_requirements": [
      "commands",
      "files_read"
    ]
  },
  {
    "schema": "task-dispatch/1",
    "ssot_id": "ws2-dev-swarm-0d26dfd05c80",
    "task_id": "swarm-ticket-flow",
    "slice_id": "swarm--runner-dependency-map",
    "agent_type": "runner",
    "slice_kind": "work",
    "timebox_minutes": 6,
    "allowed_paths": [],
    "ownership_paths": [],
    "dependencies": [],
    "task_contract": {
      "goal": "Map runnable ticket order and lock collision risks.",
      "acceptance": [
        "Return dependency graph for the first write wave.",
        "Call out any ownership collisions that must be avoided."
      ],
      "constraints": [
        "Read-only.",
        "No repository edits."
      ],
      "no_touch": []
    },
    "evidence_requirements": [
      "commands"
    ]
  },
  {
    "schema": "task-dispatch/1",
    "ssot_id": "ws2-dev-swarm-0d26dfd05c80",
    "task_id": "swarm-ticket-flow",
    "slice_id": "swarm--builder-protocol-docs",
    "agent_type": "builder",
    "slice_kind": "work",
    "timebox_minutes": 12,
    "allowed_paths": [
      "multi-agent/SKILL.md",
      "multi-agent/PLAYBOOK.md",
      "multi-agent/COUNCIL.md"
    ],
    "ownership_paths": [
      "multi-agent/SKILL.md",
      "multi-agent/PLAYBOOK.md",
      "multi-agent/COUNCIL.md"
    ],
    "dependencies": [
      "swarm--runner-inventory"
    ],
    "task_contract": {
      "goal": "Update protocol docs to Swarm-first guidance.",
      "acceptance": [
        "Docs remove linear plan-first gating.",
        "Docs describe wait-any replenishment and ownership locks."
      ],
      "constraints": [
        "Only edit owned paths."
      ],
      "no_touch": []
    },
    "evidence_requirements": [
      "diff"
    ]
  },
  {
    "schema": "task-dispatch/1",
    "ssot_id": "ws2-dev-swarm-0d26dfd05c80",
    "task_id": "swarm-ticket-flow",
    "slice_id": "swarm--builder-schemas",
    "agent_type": "builder",
    "slice_kind": "work",
    "timebox_minutes": 12,
    "allowed_paths": [
      "multi-agent/schemas/",
      "multi-agent/tools/make_council_bootstrap.py"
    ],
    "ownership_paths": [
      "multi-agent/schemas/",
      "multi-agent/tools/make_council_bootstrap.py"
    ],
    "dependencies": [
      "swarm--runner-dependency-map"
    ],
    "task_contract": {
      "goal": "Update schemas and bootstrap tooling for Swarm-first contracts.",
      "acceptance": [
        "Dispatch and worker-result schemas validate.",
        "No legacy agent types remain."
      ],
      "constraints": [
        "Only edit owned paths."
      ],
      "no_touch": []
    },
    "evidence_requirements": [
      "diff",
      "verification"
    ]
  },
  {
    "schema": "task-dispatch/1",
    "ssot_id": "ws2-dev-swarm-0d26dfd05c80",
    "task_id": "swarm-ticket-flow",
    "slice_id": "swarm--builder-e2e",
    "agent_type": "builder",
    "slice_kind": "work",
    "timebox_minutes": 12,
    "allowed_paths": [
      "dev/multi-agent/"
    ],
    "ownership_paths": [
      "dev/multi-agent/"
    ],
    "dependencies": [
      "swarm--builder-protocol-docs",
      "swarm--builder-schemas"
    ],
    "task_contract": {
      "goal": "Update e2e fixtures and validator for Swarm-first behavior.",
      "acceptance": [
        "Fixtures validate against updated schemas.",
        "No legacy linear gating invariants remain."
      ],
      "constraints": [
        "Only edit owned paths."
      ],
      "no_touch": []
    },
    "evidence_requirements": [
      "diff",
      "verification"
    ]
  },
  {
    "schema": "task-dispatch/1",
    "ssot_id": "ws2-dev-swarm-0d26dfd05c80",
    "task_id": "swarm-ticket-flow",
    "slice_id": "swarm--builder-nix",
    "agent_type": "builder",
    "slice_kind": "work",
    "timebox_minutes": 10,
    "allowed_paths": [
      "home/codex/config.toml",
      "home/codex.nix"
    ],
    "ownership_paths": [
      "home/codex/config.toml",
      "home/codex.nix"
    ],
    "dependencies": [
      "swarm--runner-inventory"
    ],
    "task_contract": {
      "goal": "Remove legacy coding agent wiring from nix-managed codex config.",
      "acceptance": [
        "No legacy coding agent references remain.",
        "max_depth stays unchanged."
      ],
      "constraints": [
        "Only edit owned paths."
      ],
      "no_touch": []
    },
    "evidence_requirements": [
      "diff"
    ]
  },
  {
    "schema": "task-dispatch/1",
    "ssot_id": "ws2-dev-swarm-0d26dfd05c80",
    "task_id": "swarm-ticket-flow",
    "slice_id": "swarm--runner-verify",
    "agent_type": "runner",
    "slice_kind": "work",
    "timebox_minutes": 8,
    "allowed_paths": [],
    "ownership_paths": [],
    "dependencies": [
      "swarm--builder-e2e",
      "swarm--builder-nix"
    ],
    "task_contract": {
      "goal": "Run smoke checks and grep gates for protocol completion.",
      "acceptance": [
        "Smoke script passes.",
        "Legacy coding agent references are absent in target paths."
      ],
      "constraints": [
        "Read-only verification only."
      ],
      "no_touch": []
    },
    "evidence_requirements": [
      "commands",
      "verification"
    ]
  },
  {
    "schema": "task-dispatch/1",
    "ssot_id": "ws2-dev-swarm-0d26dfd05c80",
    "task_id": "swarm-ticket-flow",
    "slice_id": "swarm--inspector-premortem",
    "agent_type": "inspector",
    "slice_kind": "review",
    "timebox_minutes": 8,
    "allowed_paths": [],
    "ownership_paths": [],
    "dependencies": [
      "swarm--runner-dependency-map"
    ],
    "task_contract": {
      "goal": "Review split safety and evidence requirements before final verification.",
      "acceptance": [
        "High-risk collisions are called out.",
        "Required evidence gates are explicit."
      ],
      "constraints": [
        "Review-only output."
      ],
      "no_touch": []
    },
    "evidence_requirements": [
      "review_notes"
    ]
  },
  {
    "schema": "task-dispatch/1",
    "ssot_id": "ws2-dev-swarm-0d26dfd05c80",
    "task_id": "swarm-ticket-flow",
    "slice_id": "swarm--inspector-final",
    "agent_type": "inspector",
    "slice_kind": "review",
    "timebox_minutes": 8,
    "allowed_paths": [],
    "ownership_paths": [],
    "dependencies": [
      "swarm--runner-verify",
      "swarm--inspector-premortem"
    ],
    "task_contract": {
      "goal": "Review final evidence and issue PASS/BLOCK/NEEDS_EVIDENCE verdict.",
      "acceptance": [
        "Findings map to concrete evidence.",
        "Final verdict is explicit and actionable."
      ],
      "constraints": [
        "Review-only output."
      ],
      "no_touch": []
    },
    "evidence_requirements": [
      "review_notes"
    ]
  }
]
