[
  {
    "schema": "task-dispatch/1",
    "ssot_id": "swarmbench-02-f95e17d3a2bf",
    "task_id": "swarmbench-02-backtest",
    "slice_id": "sb02--builder-long",
    "agent_type": "builder",
    "slice_kind": "work",
    "work_package_id": "pkg-alpha",
    "expected_work_s": 1500,
    "timebox_minutes": 12,
    "allowed_paths": [
      "/tmp/swarmbench-02/alpha"
    ],
    "ownership_paths": [
      "/tmp/swarmbench-02/alpha"
    ],
    "task_contract": {
      "goal": "Run long branch in parallel.",
      "acceptance": [
        "Long branch completes."
      ],
      "constraints": [
        "Only edit owned paths"
      ]
    }
  },
  {
    "schema": "task-dispatch/1",
    "ssot_id": "swarmbench-02-f95e17d3a2bf",
    "task_id": "swarmbench-02-backtest",
    "slice_id": "sb02--builder-pack-short-plus-after",
    "agent_type": "builder",
    "slice_kind": "work",
    "work_package_id": "pkg-beta",
    "expected_work_s": 1500,
    "timebox_minutes": 12,
    "allowed_paths": [
      "/tmp/swarmbench-02/beta"
    ],
    "ownership_paths": [
      "/tmp/swarmbench-02/beta"
    ],
    "task_contract": {
      "goal": "Execute short branch and its follow-up inside one package.",
      "acceptance": [
        "Short work and follow-up complete in one package ticket."
      ],
      "constraints": [
        "Only edit owned paths"
      ]
    }
  }
]
