[
  {
    "schema": "task-dispatch/1",
    "ssot_id": "e2e-council-bootstrap-ad022109e5ae",
    "task_id": "council-bootstrap",
    "slice_id": "e2e-council-bootstrap-council-runner-mapper",
    "agent_type": "runner",
    "slice_kind": "work",
    "timebox_minutes": 6,
    "allowed_paths": [],
    "ownership_paths": [],
    "dependencies": [],
    "task_contract": {
      "goal": "Map ownership boundaries and dependency risks for safe parallel scheduling.",
      "acceptance": [
        "Return ownership map and collision risks.",
        "Recommend a practical parallel dispatch order."
      ],
      "constraints": [
        "Read-only investigation.",
        "No repository content modifications."
      ],
      "no_touch": []
    },
    "evidence_requirements": [
      "commands",
      "analysis"
    ]
  },
  {
    "schema": "task-dispatch/1",
    "ssot_id": "e2e-council-bootstrap-ad022109e5ae",
    "task_id": "council-bootstrap",
    "slice_id": "e2e-council-bootstrap-council-inspector-pre-mortem",
    "agent_type": "inspector",
    "slice_kind": "review",
    "timebox_minutes": 8,
    "allowed_paths": [],
    "ownership_paths": [],
    "dependencies": [],
    "task_contract": {
      "goal": "Run a pre-mortem protocol review of planned dispatch topology.",
      "acceptance": [
        "Flag high coupling risks, ownership clashes, and sequencing hazards.",
        "Recommend changes needed before downstream worker dispatch."
      ],
      "constraints": [
        "Review-only output.",
        "No repository edits."
      ],
      "no_touch": []
    },
    "evidence_requirements": [
      "review_notes"
    ]
  }
]
