[
  {
    "schema": "task-dispatch/1",
    "ssot_id": "swarmbench-01-a89a470b619a",
    "task_id": "swarmbench-01-backtest",
    "slice_id": "sb01--builder-lock-a",
    "agent_type": "builder",
    "timebox_minutes": 8,
    "allowed_paths": [
      "/tmp/swarmbench-01/shared",
      "/tmp/swarmbench-01/shared/logs"
    ],
    "ownership_paths": [
      "/tmp/swarmbench-01/shared"
    ],
    "dependencies": [
      "sb01--runner-map"
    ],
    "task_contract": {
      "goal": "Run the first shared-path builder slice.",
      "acceptance": [
        "Writes shared artifact A."
      ],
      "constraints": [
        "Only edit owned paths"
      ]
    },
    "evidence_requirements": [
      "diff"
    ]
  },
  {
    "schema": "task-dispatch/1",
    "ssot_id": "swarmbench-01-a89a470b619a",
    "task_id": "swarmbench-01-backtest",
    "slice_id": "sb01--builder-lock-a-copy",
    "agent_type": "builder",
    "timebox_minutes": 8,
    "allowed_paths": [
      "/tmp/swarmbench-01/shared/logs/",
      "/tmp/swarmbench-01/shared/"
    ],
    "ownership_paths": [
      "/tmp/swarmbench-01/shared/"
    ],
    "dependencies": [
      "sb01--runner-map"
    ],
    "task_contract": {
      "goal": "Run the first shared-path builder slice.",
      "acceptance": [
        "Writes shared artifact A.",
        "Adds a verification note."
      ],
      "constraints": [
        "Only edit owned paths"
      ]
    },
    "evidence_requirements": [
      "verification",
      "diff"
    ]
  }
]
